{
  "schema_version": "bpa.scenario.v2",
  "scenario_id": "synthetic-handover-v2-consent-expiry",
  "environment": "synthetic",
  "description": "Model confidence stays high; the authorization decision changes when consent expires.",
  "consent": {
    "subject_ref": "synthetic-subject-001",
    "purpose": "laboratory-handover",
    "scope": "robot-hand-handover",
    "valid_from_ms": 0,
    "valid_until_ms": 2000,
    "revoked_at_ms": null
  },
  "identity_assertion": {
    "subject_ref": "synthetic-subject-001",
    "issuer_ref": "synthetic-local-verifier",
    "purpose": "laboratory-handover",
    "scope": "robot-hand-handover",
    "verified": true,
    "issued_at_ms": 900,
    "expires_at_ms": 3000
  },
  "policy": {
    "policy_ref": "handover-policy-v2",
    "min_model_confidence": 0.8,
    "max_identity_age_ms": 2000,
    "max_proposal_age_ms": 100,
    "require_bci_intent": true,
    "require_human_approval": true
  },
  "action_requests": [
    {
      "request_id": "handover-1",
      "at_ms": 1000,
      "subject_ref": "synthetic-subject-001",
      "purpose": "laboratory-handover",
      "scope": "robot-hand-handover",
      "proposal": {"model_ref": "synthetic-vla-v1", "created_at_ms": 990, "confidence": 0.95},
      "intent": {"value": true, "issued_at_ms": 990, "expires_at_ms": 1100},
      "safety": {"value": true, "issued_at_ms": 990, "expires_at_ms": 1100},
      "approval": {"value": true, "issued_at_ms": 990, "expires_at_ms": 1100},
      "expected_allow": true
    },
    {
      "request_id": "handover-2",
      "at_ms": 2200,
      "subject_ref": "synthetic-subject-001",
      "purpose": "laboratory-handover",
      "scope": "robot-hand-handover",
      "proposal": {"model_ref": "synthetic-vla-v1", "created_at_ms": 2190, "confidence": 0.98},
      "intent": {"value": true, "issued_at_ms": 2190, "expires_at_ms": 2300},
      "safety": {"value": true, "issued_at_ms": 2190, "expires_at_ms": 2300},
      "approval": {"value": true, "issued_at_ms": 2190, "expires_at_ms": 2300},
      "expected_allow": false
    }
  ]
}
